{
  "id": "checkboxes-toggle",
  "name": "User can toggle checkboxes",
  "description": "Verifies checkbox1 can be checked and checkbox2 can be unchecked. Targets resolve via cssNth from the page map — no hardcoded locators.",
  "tags": ["ui", "checkboxes"],
  "steps": [
    { "action": "open", "target": "/checkboxes" },
    { "action": "check", "target": "checkboxes.checkbox1" },
    { "action": "verifyChecked", "target": "checkboxes.checkbox1" },
    { "action": "uncheck", "target": "checkboxes.checkbox2" },
    { "action": "verifyUnchecked", "target": "checkboxes.checkbox2" }
  ]
}
